{
    "skills": [
        "Python",
        "Java",
        "C++",
        "SQL",
        "HTML",
        "CSS",
        "PHP",
        "Git",
        "Linux",
        "MySQL"
    ],
    "personal_details": {
        "name": "PRATHMESH BHARAT",
        "phone": "+91-7057393293",
        "email": "prathmeshparkhe07@gmail.com"
    },
    "education": [
        {
            "degree": "M.C.A. - Computer Applications | CGPA: 7",
            "duration": "7"
        },
        {
            "degree": "B.Com. - Commerce - Commerce | Percentage : 77",
            "duration": "77"
        }
    ],
    "projects": [],
    "text": "PRATHMESH BHARAT PARKHE\nM.C.A. - Computer Applications\nPh: +91-7057393293\nEmail: prathmeshparkhe07@gmail.com\nPimpri, Maharashtra, India - 411018\nBRIEF SUMMARY\nHighly motivated and hardworking individual looking for Internship/Job opportunity where I can contribute my skills and knowledge for\nthe growth of the organization.\nKEY EXPERTISE\nJava HTML5 CSS MySQL PHP C++ Python Git Linux\nEDUCATION\nDr. D. Y. Patil Institute of Management and Research 2022 - 2025\nM.C.A. - Computer Applications | CGPA: 7.89 / 10\nSangamner Nagarpalika Arts, D.J.Malpani Commerce and B.N.Sarda Science College\nB.Com. - Commerce - Commerce | Percentage : 77.07 / 100\nSangamner Junior College, Sangmaner 2020\n12th | Percentage: 82 / 100\nDigambar Ganesh Saraf Vidyalaya, Sangamner 2018\n10th | Percentage: 84 / 100\nPROJECTS\nAir Canvas 04 Oct, 2024 - 05 Dec, 2024\nMentor: Prof. Sushil Kulkarni | Team Size: 1\nKey Skills: Python Opencv Python Mediapipe\nAir Canvas, a digital drawing tool that allows users to draw in the air using their hands without the need for traditional input devices such\nas a mouse or stylus. The system leverages real-time hand tracking technology powered by Mediapipe and OpenCV to capture the\nuser's hand gestures and translate them into drawing commands on a virtual canvas.\nE-Learning 05 Jan, 2024 - 05 Apr, 2024\nMentor: Prof. Sushil Kulkarni | Team Size: 1\nKey Skills: PHP HTML5 Bootstrap CSS MySQL\nProject Link: https://github.com/Prathmesh1707/E-Learning\n\u201cSkillUpNow\u201d is a web-based application e-learning website created with HTML, CSS, and PHP offers a broad range of educational\nopportunities. Individuals can access diverse courses, from coding to art, in a user-friendly interface.\nASSESSMENTS / CERTIFICATIONS\nJava Training\nKey Skills: Core Java Advanced Java\nMastering Python Essentials\nKey Skills: Python jupyter notebook\nTableau Data Visualization\nKey Skills: Data Visualization Data AnalysisPERSONAL DETAILS\nGender: Male Date of Birth: 17 Jul, 2003\nMarital Status: Single Known Languages: English, Hindi, Marathi\nCurrent Address: Akshay Housing Society Lane 1, Sant Permanent Address: Bharat Nagar col.4, Maldad Road,\nTukaram Nagar, Pimpri, Pimpri, Maharashtra, India - 411018 Sangmaner, Sangamner, Maharashtra, India - 422605\nPhone Number: +91-7057393293\nEmail: prathmeshparkhe07@gmail.com"
}